{
  "schema_version": "1.0.0",
  "network_name": "QBIND Public DevNet (experimental)",
  "environment": "devnet",
  "runtime_chain_id": "0x51424E4444455600",
  "genesis_hash": "0x48b3a862befe50e31bad5e1e11ba1ad282dc65723b1989e9ce2091b4af18145f",
  "genesis_file_sha256": "d1db07febcf76267f9d3e277a0ff99d06bbe5dffd59d0607799521562ec5c86c",
  "safety_label": {
    "experimental": true,
    "resettable": true,
    "no_value": true,
    "no_mainnet_readiness_claim": true,
    "no_c4_c5_closure_claim": true
  },
  "placeholder_statement": "This is a live-seed CANDIDATE document (still a PREFLIGHT). Its single entry uses status 'planned' with a non-routable RFC 5737 (TEST-NET-3) documentation host because external reachability from OUTSIDE the seed operator's own host/NAT has NOT been proven. Run 377 demonstrated only loopback / same-host reachability (Route B / Partial-positive). Run 378 attempted Route A (real external reachability from an independent external vantage point) but the sandboxed environment has NO external ingress and NO independent external vantage point, so no real endpoint could be exposed and external reachability could NOT be proven (Route C — no safe external seed infrastructure available). Run 388 re-executed the Route A objective and reached the same Route C finding, and Run 391 re-executed it again with the same Route C finding (unchanged; Run 386/387 preflight posture signed_release=false / slsa_grade=false is likewise unchanged). This document contains NO live seeds and NO externally reachable infrastructure. Public DevNet is NOT launch-ready. M4 (seed/bootnodes) remains a public DevNet launch blocker until external reachability evidence for a real, externally reachable seed node lands and this entry is promoted to status 'live' with a non-null last_reachability_evidence reference. See docs/release/public-devnet/network/reachability/RUN_391_qbind-devnet-seed-1.md (Route A infrastructure prerequisites) and docs/devnet/QBIND_DEVNET_EVIDENCE_RUN_391.md.",
  "seed_nodes": [
    {
      "node_id": "4111c4be4715f26d8cf6f9d3764f2ff7779bd431036ece77d28f47567945f688",
      "peer_id": "4111c4be4715f26d8cf6f9d3764f2ff7779bd431036ece77d28f47567945f688",
      "validator_address": null,
      "p2p_host": "203.0.113.10",
      "p2p_port": 30333,
      "p2p_multiaddr": "203.0.113.10:30333",
      "transport_security_mode": "kemtls-mutual-auth-required",
      "pqc_suite": "ml-dsa-44",
      "trust_bundle_required": true,
      "expected_genesis_hash": "0x48b3a862befe50e31bad5e1e11ba1ad282dc65723b1989e9ce2091b4af18145f",
      "operator": "qbind-devnet-seed-1-preflight",
      "status": "planned",
      "last_reachability_evidence": null,
      "notes": "PREFLIGHT CANDIDATE - NOT A LIVE SEED. node_id/peer_id are REAL public identifiers produced by the Run 375 `qbind-node identity generate devnet seed` path; the corresponding ML-KEM-768 leaf secret and in-memory ML-DSA-44 root signing key were generated in an ephemeral temp directory and DISCARDED, so this identity is illustrative only and MUST be replaced by the operator's durable seed identity before any live publication. p2p_host 203.0.113.10 is an RFC 5737 TEST-NET-3 documentation address and is NOT externally reachable. status is 'planned' (NOT 'live') and last_reachability_evidence is null. External reachability itself is no longer unproven: Run 377 proved loopback/same-host reachability (Route B); Runs 378/388/391/393 attempted Route A but found no independent off-host vantage in the sandboxed environment (Route C); and Run 416 achieved the FIRST successful real external Route A reachability (external TCP + KEMTLS mutual-auth static-root) to a routable public seed from a genuinely independent off-host dialer (see network/reachability/RUN_416_qbind-devnet-seed-1.md). This candidate nevertheless stays 'planned' with null evidence because the Run 416 seed used a TEMPORARY, DISCARDED operator identity on a non-durable endpoint - NOT this candidate's durable identity - and no `devnet-seeds.live.json` is published. To promote to status 'live': stand up a DURABLE externally reachable KEMTLS static-root seed bound to this candidate's own identity, capture external reachability evidence from an independent external vantage point, set p2p_host/p2p_multiaddr/operator to the real public values, set status 'live', and set last_reachability_evidence to the evidence reference. `qbind-node identity register-check --status live --reachability-evidence <ref>` accepts exactly that shape and fails closed without the evidence reference."
    }
  ]
}